,Referance Case,Ref,Type,Context,Scenario,Task with 3 Ambiguities,Ambiguities 3,Questions 3,Task with 1 Ambiguity,Question 1,No Ambiguity
14,Benevento Foods: When the Rubber Hits the Dough | Harvard Business Impact Education,"David Wood, Stephan Vachon, Micheline Singh, 2015",Tactical,Quality Control,"Scenario:
You are managing a quality escalation after a client reported rubber fragments in a shipment. You must immediately adjust the production planning to replace the compromised stock without disrupting other orders. Simultaneously, you need to launch a process improvement audit to secure the manufacturing line and oversee the campaign planning for recovery effort to restore confidence.
Available Actions:
Recall and Isolate: Issue a recall for the affected batch and launch an internal audit of the specific production line.
External Investigation: Hire an external quality control consultant to conduct a full, independent investigation of all processes.
Cultural Review: Form an internal task force to review the company's quality culture and accountability procedures.","The board requires this crisis to be handled effectively. You must provide the customer a root cause report within 7 days, but standard protocol requires a 30-day review for any major incident. A new rule also requires a report on all production line and equipment failures. Given these conditions determine the best course of action.","Definition Imprecision 
Linguistic Imprecision (Scope)
Knowledge Inconsistency","1. Definition Imprecision (DI):
What does handling this ""effectively"" means? (e.g., providing a rapid response to satisfy the customer immediately, or conducting a thorough, comprehensive investigation to ensure the problem never happens again?)
2. Linguistic Imprecision (LI):
What is the scope of the report on ""all production line and equipment failures""? (e.g., a report is needed only if the failure involves both the line AND the equipment, or is a report needed for any failure on the line OR any failure with the equipment?)
3. Knowledge Inconsistency (KI):
Which of the conflicting timelines takes priority? (e.g., the urgent 7-day deadline to report to the customer, or the standard 30-day internal review protocol for major incidents?)","The board has clarified that your primary objective is to provide a rapid response to satisfy the customer immediately. They have confirmed that for explaining root cause there is 7-day customer deadline and this takes absolute priority over the standard 30-day internal review protocol. As part of this process, a new rule requires a report on all production line and equipment failures.","Linguistic Imprecision (LI):
What is the scope of the report on ""all production line and equipment failures""? (e.g., a report is needed only if the failure involves both the line AND the equipment, or is a report needed for any failure on the line OR any failure with the equipment?)","The board has clarified that your primary objective is to provide a rapid response to satisfy the customer immediately. They have confirmed that for explaining root cause there is 7-day customer deadline and this takes absolute priority over the standard 30-day internal review protocol. Furthermore, the reporting rule states that: a report is required for any incident that involves either a production line failure or a separate equipment failure and this report can be generated by our technicians using our proprietary line-monitoring software. Given these conditions, determine the best strategy."
15,Amul Dairy: Expanding a Legacy | Harvard Business Impact Education,Ashita Aggarwal,Tactical,Pricing,"BurgerBar is launching a pilot for digital menu boards. Following public backlash over rumors of ""surge pricing,"" Regional Manager Alex must configure the pricing algorithm for the upcoming month. The goal is to smooth out customer flow using price incentives without triggering further public relations outrage or technical glitches during the test run.
Available Actions:
Discount Mode: Configure boards to strictly lower prices during off-peak hours to safely drive traffic.
Static Mode: Disable dynamic features and keep prices fixed to minimize consumer friction.
Full Dynamic: Enable real-time price adjustments (up and down) to gather maximum data.","The Standard Operations Manual states that menu prices must be fixed daily, and the Pilot Memo explicitly instructs us to change prices based on demand. Alex noted that he is worried about the promotion this week. Furthermore, the algorithm settings must be conservative. Given these constraints, determine the configuration.","Knowledge Inconsistency 
Linguistic Imprecision (Lexical/Semantic)
Definition Imprecision","Knowledge Inconsistency: Which rule takes precedence? (e.g., The Pilot Memo overrides the Manual, or The Standard Manual is binding and cannot be violated?)
Linguistic Imprecision (Lexical/Semantic): What does the word ""promotion"" refer to? (e.g., The ""Smart Savings"" marketing campaign designed to rebuilt brand trust, or Alex's potential job advancement/career rank?)
Definition Imprecision: What specifically defines ""conservative"" in this context? (e.g., Price fluctuations limited to +/- 5%, or Using a low-risk, high-stability software mode?)","Management has authorized a specific operational exception for this pilot, allowing price changes that supersede the Standard Manual's fixed pricing requirement. Alex noted that he is worried about the 'Smart Savings' marketing campaign, which is designed to demonstrate that our prices are responsive and fair. Furthermore, the algorithm settings must be conservative. Given these constraints, determine the configuration","Definition Imprecision: What specifically defines ""conservative"" in this context? (e.g., Price fluctuations limited to +/- 5%, or Using a low-risk, high-stability software mode?)","Management has authorized a specific operational exception for this pilot, allowing price changes that supersede the Standard Manual's fixed pricing requirement. Alex noted that he is worried about the 'Smart Savings' marketing campaign, which is designed to demonstrate that our prices are responsive and fair. Furthermore, the algorithm must strictly enforce price fluctuations within a +/- 5% band from a publicly displayed baseline price, ensuring that any change is minimal and transparent. Given these constraints, determine the configuration."
16,https://hbsp.harvard.edu/product/8477-HTM-ENG,Puri et al 2024,Tactical,Marketing Allocation,"Scenario:
PureFlow Inc. is launching ""SilkShine"" squeeze tubes in the Philippines. While the format offers convenience, Marketing Director Maria fears it will cannibalize sales of the core bottle line. The President demands aggressive growth, but consumer preferences vary wildly between Luzon, Visayas, and Mindanao, with urban Luzon characterized by high-frequency, small-volume purchases, while Visayas and Mindanao are dominated by cost-conscious, bulk-buying behaviors. Maria must finalize the Q3 inventory allocation and promotional spend across these regions to maximize net revenue without destroying the existing bottle business.
Available Actions:
Uniform Push: Allocate inventory and ad spend evenly across all three regions to ensure nationwide visibility.
Metro Focus: Concentrate 70% of resources in urban Luzon where convenience demands are highest, minimizing cannibalization elsewhere.
Defensive Split: Limit tube inventory to 20% in all regions to protect bottle sales while testing the market.","The strategic plan mandates minimizing cannibalization of existing products, and the Sales Director explicitly ordered us to prioritize maximum total unit volume. We must also adjust the resource allocation based on the specific competitor response data. Additionally, the target cities must ensure strong market uptake. Given these factors, determine the allocation strategy.","Knowledge Inconsistency
Contextual Uncertainty (Contextual Missing Elements)
Definition Imprecision","Knowledge Inconsistency: Which goal takes precedence? (e.g., Protecting existing bottle sales from cannibalization, or Maximizing total unit volume regardless of product mix?)
Contextual Uncertainty (Contextual Missing Elements:) What specific competitor response data is missing? (e.g., Their planned 5% price cuts for the quarter, or Their upcoming product launch dates?)
Definition Imprecision: What specifically defines ""strong market uptake""? (e.g., Selling 80% of opening inventory within month one, or Achieving 5% market share by Q3?)","Leadership has confirmed that achieving the highest possible return on investment and securing a defensible market entry is the primary objective, prioritizing profitable, high-probability wins. We must also adjust the resource allocation based on the specific competitor response data. Additionally, we must ensure we achieve 5% market share specifically in the high-density urban centers of Luzon. Given these factors, determine the allocation strategy.","Contextual Uncertainty (Contextual Missing Elements): What specific competitor response data is missing? (e.g., Their planned price cuts for the quarter, or Their upcoming product launch dates?)","Leadership has confirmed that achieving the highest possible return on investment and securing a defensible market entry is the primary objective, prioritizing profitable, high-probability wins. We must also adjust allocation based on competitor data showing they hold an 85% monopoly on bulk-buying in Visayas and Mindanao and are planning defensive price cuts. Additionally, we must ensure we achieve 5% market share specifically in the high-density urban centers of Luzon. Given these factors, determine the allocation strategy."
17,https://hbsp.harvard.edu/product/7921-HTM-ENG,,Tactical,Product Execution,"Scenario:
VisionVR is close to becoming a billion-dollar company, but their new VR app is late. The coding team and the design team are fighting, so the work isn't finished. Investors are getting nervous and might stop giving money. VP Lisa needs to decide exactly what the team should work on upcoming month to get a version ready fast. She must choose what to prioritize to save the funding.
Available Actions:
Fix Bugs: Stop adding new things and only fix errors to make sure the app works perfectly.
Make it Pretty: Spend the week making the graphics look amazing to impress investors, even if the app has some errors.
Work Overtime: Force the team to work nights and weekends to try and do everything at once.","We must make sure the architecture is ready for inspection. Lisa also emphasized that the user experience must be smooth. However, our strict deadline depends entirely on the specific date of the investor meeting. We cannot afford to fail. Given these conditions, determine the best plan.","Linguistic Imprecision (Lexical/Semantic)
Definition Imprecision
Contextual Uncertainty (Temporal/Event)","Linguistic Imprecision (Lexical/Semantic): What does the word ""architecture"" refer to here? (e.g., The 3D buildings and structures in the VR world [requiring design polish], or The underlying software code structure [requiring bug fixes]?)
Definition Imprecision: What specifically defines ""smooth""? (e.g., The app runs fast without freezing, or The buttons and menus are easy to understand?)
Contextual Uncertainty (Temporal/Event): When exactly is the ""investor meeting""? (e.g., Tomorrow morning, meaning we must rush, or Next Friday, giving us more time?)","We must make sure the architecture is ready for inspection. Lisa also emphasized that the user experience must be smooth by specifically ensuring the app runs fast without freezing. However, our strict deadline is driven by the investor meeting scheduled for tomorrow morning, meaning we must rush. We cannot afford to fail. Given these conditions, determine the best plan.","Linguistic Imprecision (Lexical/Semantic): What does the word ""architecture"" refer to here? (e.g., The 3D buildings and structures in the VR world [requiring design polish], or The underlying software code structure [requiring bug fixes]?)","We must ensure the underlying software code is ready for inspection as live demo during the investor meeting scheduled for tomorrow morning, meaning we must rush. Lisa also emphasized that the user experience must be smooth defined as zero crashes during the scripted demo sequence, even if background features remain buggy. Given these conditions, determine the best plan."
18,Author Curated,Author Curated,Tactical,Resource Allocation,"Scenario:
You are the Production Planning Manager at TechSolutions Inc. A key client submitted a large, urgent order for specialized components, exceeding your forecasted capacity for the upcoming quarter. You must now revise the production schedule and allocate manufacturing capacity.

Available Actions:
Reallocate resources to fully prioritize the urgent client order, delaying a percentage of standard forecasted orders by two weeks.
Authorize 20 hours of production line overtime for the upcoming quarter to concurrently meet both urgent and existing orders.
Subcontract 30% of the urgent client order to an approved third-party manufacturer at a 15% increased unit cost.","The company policy diasllows overtime to save money, and the VP explicitly told you to do whatever it takes to finish this job. We need to confirm the production schedule to meet the requirements of one of the clients. Additionally, the instructions say we should delay small orders and shipments. Given these issues, decide the best way to handle the schedule.","Knowledge Inconsistency
Contextual Uncertainty (Contextual Missing Elements)
Linguistic Imprecision (Structural/Syntactic)","Contextual Missing Elements: Which specific client placed this order? (e.g., Is it our top-tier strategic partner requiring immediate resource reallocation, or a low-tier client where we can use a third-party manufacturer?)
Knowledge Inconsistency: Which rule should I follow? (e.g., The VP's urgent mandate overrides the standard policy, or The strict no-overtime policy is binding and cannot be violated?)
Structural/Syntactic Ambiguity: Does the adjective ""small"" describe the shipments as well? (e.g., Delay [small orders] and [all shipments], or Delay [small orders] and [small shipments]?)","The strict company policy forbids overtime to save money, and the VP explicitly told you to do whatever it takes to finish this job. We must confirm the schedule to meet the requirements of our top-tier strategic partner, which is our highest priority. Additionally, the instructions explicitly state we should delay both small orders and small shipments to free up capacity. Given these issues, decide the best way to handle the schedule.","Knowledge Inconsistency: Which rule should I follow? (e.g., The VP's urgent mandate overrides the standard policy, or The strict no-overtime policy is binding and cannot be violated?)","Executive leadership is directly enforcing the budget cap, overriding the VP's request for overtime and requiring us to prioritize delivery speed through schedule adjustments. We must confirm the schedule to meet the requirements of our top-tier strategic partner, which is our highest priority. Additionally, the instructions explicitly state we should delay both small orders and small shipments to free up capacity. Given these issues, decide the best way to handle the schedule."
19,Author Curated,,Tactical,Inventory management,"Scenario:
You are the Inventory Manager at Sweet Season Confections. You need to set the exact inventory targets for the premium chocolate line. With the upcoming Valentine's Day holiday, you need to finalize the target inventory and safety stock levels for your premium boxed chocolates based on historical sales data and current forecasts.

Available Actions:
Conservative Stocking: Set inventory and safety stock at the lower end of historical averages, prioritizing minimized carrying costs.
Aggressive Stocking: Set inventory and safety stock at the higher end of historical forecasts, prioritizing meeting potential peak demand.
Moderate with Responsive Buffer: Set inventory at the historical median, implementing a scalable safety stock plan for rapid adjustment.","We must secure inventory target for the high-end collection. Additionally, the plan requires that every regional warehouse needs ten safety pallets. The corporate handbook explicitly mandates minimizing inventory waste, and the CEO directed us to ensure maximum product availability. Given these constraints, determine the optimal inventory level.","Definition Imprecision
Linguistic Imprecision (Scope)
Knowledge Inconsistency","Definition Imprecision: What specific products are defined as ""high-end""? (e.g., Only the $50+ Gold Boxes, or Any box containing truffles regardless of price?)

Linguistic Imprecision (Scope and Quantification): Does the requirement mean ten pallets total shared across all warehouses, or ten unique pallets for each warehouse?

Knowledge Inconsistency: Which directive takes precedence? (e.g., The corporate mandate for zero waste is absolute, or The CEO's instruction for 100% availability overrides the handbook?)","Leadership has established maximum product availability as the overriding strategic priority for the holiday season, explicitly subordinating the handbook's waste minimization protocols. We must secure sufficient stock for the high-end collection. Additionally, the plan requires that every regional warehouse needs ten unique safety pallets for each location, a high-volume buffer that exceeds the storage limits of the average historical sales forecasts. Given these constraints, determine the optimal strategy.","Definition Imprecision: What specific products are defined as ""high-end""? (e.g., Only the $50+ Gold Boxes, or Any box containing truffles regardless of price?)","Leadership has established maximum product availability as the overriding strategic priority for the holiday season, explicitly subordinating the handbook's waste minimization protocols. We must finalize the inventory targets for only the $50+ Gold Boxes which represent a low 2% of total volume, posing a negligible financial risk. Additionally, the plan requires that every regional warehouse needs ten unique safety pallets for each location, a high-volume buffer that exceeds the storage limits of the average historical sales forecasts. Given these constraints, determine the optimal strategy."
20,Author curated,,Operational,Daily Unit Depl,"Scenario:
 You are the Field Operations Manager at CityConnect Services. An unexpected storm has caused damage to home devices in the city and there are many urgent service requests, straining your daily maintenance schedule. You must decide on the deployment plan for your teams today.
 
 Available Actions:
 Dedicate Emergency Team: Re-route one team to handle all storm-related emergencies, postponing their routine maintenance tasks until tomorrow.
 Approve Overtime: Authorize four hours of overtime for three teams to cover new urgent issues, while maintaining other scheduled routine tasks.
 Dynamic Re-routing: Instruct all teams to complete closest routine tasks quickly, then dynamically re-assign them to urgent storm-related damages.","The Regional Director insisted that our service level during this crisis must be optimal. We need to align our team movements with the upcoming grid reset.  Additionally, the instructions stated to secure the lead in the affected sector. Given the storm conditions, determine the best strategy.","Definition Imprecision
Contextual Uncertainty (Temporal/Event)
Linguistic Imprecision (Lexical/Semantic)","Definition Imprecision: What specifically defines ""optimal"" service in this context? (e.g., Maximizing speed/number of tickets closed, or Prioritizing the quality and safety of each repair?)
Contextual Uncertainty (Temporal/Event Context): When exactly is the ""grid reset""? (e.g., Occurring in 1 hour, requiring teams to pause now, or Scheduled for tonight, allowing full operations today?)
Linguistic Imprecision (Lexical/Semantic): What does the word ""lead"" refer to? (e.g., The main electrical cable/connection being repaired, or The team leader/supervisor responsible for the sector?)","The Regional Director insisted that our service level must be optimal, defined as clearing at least 90% of the urgent ticket queue without postponing any routine maintenance for high-value clients.  We need to align our team movements with the upcoming grid reset. We must secure the lead which is the damaged main electrical cables scattered across the sector, a task that requires multiple teams. Given the storm conditions, determine the best strategy.","Contextual Uncertainty (Temporal/Event Context): When exactly is the ""grid reset""? (e.g., Occurring in 1 hour, requiring teams to pause now, or Scheduled for tonight, allowing full operations today?)","The Regional Director insisted that our service level must be optimal, defined as clearing at least 90% of the urgent ticket queue without postponing any routine maintenance for high-value clients. We must align our team movements with the grid reset scheduled for 6 hours from now. We must secure the lead which is the damaged main electrical cables scattered across the sector, a task that requires multiple teams. Given the storm conditions, determine the best strategy"
21,Author curated,,Operational,Resource Alloca,"Scenario:
 You are the Operations Manager at SwiftDeliver Logistics. Due to an unexpected local festival, tomorrow's package volume has surged by 30%. You must decide on the optimal allocation of drivers and delivery vehicles for the upcoming daily routes.
 
 Available Actions:
 Reassign current drivers to prioritize high-density routes, and postpone lower-priority packages for later delivery. 
 Authorize paid overtime for five experienced drivers to cover additional routes, using backup vehicles. 
 Contract a local third-party courier service for the top 10% highest volume routes, paying a premium.","We need to prioritize urgent medical supplies and electronics. Additionally, the Regional Director mandated that our on-time performance must be acceptable. Corporate policy prohibits using third-party couriers to protect data, given that the VP explicitly ordered us to outsource routes if volume spikes.Given the conditions, determine the best allocation.","Linguistic Imprecision (Structural/Syntactic)
Definition Imprecision
Knowledge Inconsistency","Linguistic Imprecision (Structural/Syntactic): Does the adjective ""urgent"" describe the electronics as well? (e.g., Prioritize [urgent medical supplies] and [urgent electronics], or Prioritize [urgent medical supplies] and [all electronics]?)
Definition Imprecision: What specifically defines ""acceptable"" performance? (e.g., Delivering 95% of packages on time, or simply ensuring no packages are lost?)
Knowledge Inconsistency: Which directive takes precedence? (e.g., The corporate policy banning third-party couriers is absolute, or The VP's order to outsource during spikes overrides the policy?)","We need to prioritize urgent medical supplies as well as all electronics, which internal analysis confirms constitute the top 10% highest volume routes. Additionally, the Regional Director mandated that our on-time performance must be acceptable, specifically defined as delivering 95% of packages on time, a threshold impossible to meet even with maximum overtime. However, corporate policy strictly prohibits using third-party couriers to protect data, given that the VP explicitly ordered us to outsource routes if volume spikes. Given the conditions determine the best allocation.","Knowledge Inconsistency: Which rule takes precedence? (e.g., The VP's order overrides the policy, or The strict ban on third-party couriers is absolute?)
","We need to prioritize urgent medical supplies as well as all electronics, which internal analysis confirms constitute the top 10% highest volume routes. The Regional Director mandated that our on-time performance must be acceptable, defined as delivering 95% of packages on time, a threshold impossible to meet even with maximum overtime. Regarding the outsourcing conflict, executive leadership has authorized an exemption to the data security policy, specifically approving the pre-vetted local courier partners who are certified for medical-grade transport. Given the conditions, determine the best allocation."
