,Referance Case,Ref,Type,Context,Scenario,Task with 3 Ambiguities,Ambiguities 3,Questions 3,Task with 1 Ambiguity,Question 1,No Ambiguity
7,https://hbsp.harvard.edu/product/8255-HTM-ENG,"Ashita Aggarwal, 2024",Strategic,,"CreamValley, a dominant dairy giant, faces plateauing growth despite its iconic status. CEO Elena Ross has developed a pipeline of 120 high-margin non-dairy products, ranging from frozen snacks to organic spices. While these could significantly boost profits, launching them risks diluting the brand's reputation for pure, authentic dairy. Elena must decide how to structure this expansion without alienating the loyal customer base.

Available Actions:
Pure Dairy Focus: Cancel the non-dairy expansion to protect the brand’s heritage and focus on premium milk products.
Aggressive Diversification: Launch all new products under the CreamValley master brand to maximize immediate visibility and revenue.
Sub-Brand Strategy: Launch the non-dairy items under a new, distinct label to mitigate risk to the core identity.","We must launch the expansion focused on the specific target market for this initial rollout. Our corporate charter mandates we remain an exclusively dairy-focused entity, given that the Board explicitly directed us to launch the non-dairy line immediately. Additionally, the launch must be impactful to customers. Given these conditions, determine the best course of action.","Contextual Uncertainty (Contextual Missing Elements)
Knowledge inconsistency
Definition Imprecision","Contextual Uncertainty (Contextual Missing Elements): Which specific demographic is the target market? (e.g., Urban millennials seeking product categorization, or Existing rural family customers?)
Knowledge Inconsistency: Which directive takes precedence? (e.g., The Board's mandate to diversify overrides the charter, or The dairy-only charter is absolute, or a mix?)
Definition Imprecision: What specifically defines ""impactful""? (e.g., Achieving $10 million in first-quarter revenue, or eliminate confusion about product features?)","We must launch the expansion immediately focused on the specific target market for this initial rollout. Management has formally authorized the diversification into non-dairy products, establishing the protection of the core dairy brand equity as the first governing priority. Additionally, the launch must be impactful, defined as capturing the new snack market without causing consumer confusion regarding lactose content or ingredients. Given these conditions, determine the best course of action.","Contextual Uncertainty (Contextual Missing Elements): Which specific demographic is the target market? (e.g., Urban millennials seeking convenience, or Existing rural family customers?)","We must launch the expansion, targeting urban millennials who value transparency about product features and clear product categorization. Management has formally authorized the diversification into non-dairy products, establishing the protection of the core dairy brand equity as the first governing priority. Additionally, the launch must be impactful, defined as capturing the new snack market without causing consumer confusion regarding lactose content or ingredients. Given these conditions, determine the best course of action."
8,https://hbsp.harvard.edu/product/7977-HTM-ENG?itemFindingMethod=search,"Mark Rennella, 2023",Strategic,,"TableShare, a startup that connects strangers for home-cooked meals, is in trouble. CEO Elena Cruz discovered that some hosts are rejecting guests based on their race or gender, which violates the company's promise of inclusivity. If she doesn't stop this, the company could get sued or lose all user trust. Elena must decide how to change the platform's functioning to stop the discrimination without angering the hosts, who provide all the food and locations.

Available Actions:
Algorithmic Matching: Remove host control entirely and assign guests automatically to eliminate bias.
Blind Booking: Hide names and photos until the booking is confirmed to reduce prejudice.
Mandatory Training: Retain the current system but require anti-bias certification for all hosts.","We must address the discrimination crisis immediately by directly approaching the group being rejected. The Board has directed us to flag discriminatory new hosts and guests. Additionally, Elena explicitly stated that the new booking mechanism must be fair to all parties. Given these constraints, determine the best course of action.","Contextual Uncertainty (Contextual Missing Elements)
Linguistic Imprecision (Structural/Syntactic)
Definition Imprecision","Contextual Uncertainty(Contextual Missing Elements:) Which specific demographic group is being rejected? (e.g., Racial minorities, or Single male applicants?)
Linguistic Imprecision(Structural/Syntactic Ambiguity:) Does the adjective ""discriminatory"" modify ""new hosts"" as well? (e.g., ban [discriminatory new hosts] and [discriminatory guests], or ban [all new hosts] and [discriminatory guests]?)
Definition Imprecision: What specifically defines ""fair"" in this context? (e.g., Ensuring equal acceptance rates across demographics, or Preserving the hosts' right to choose who enters their home?)","We must address the discrimination crisis regarding racial minorities, who are being systematically rejected. The Board has directed us to flag discriminatory new hosts and guests. Additionally, Elena explicitly stated that the new booking mechanism must be fair, specifically defined as implementing a preventive product feature that preserves host autonomy by anonymizing guest identity until the booking is confirmed. Given these conditions, determine the best course of action.","Linguistic Imprecision (Structural/Syntactic Ambiguity): Does the adjective ""discriminatory"" modify ""new hosts"" as well? (e.g., Sanction [discriminatory new hosts] and [discriminatory guests], or Sanction [all new hosts] and [discriminatory guests]?)","We must address the discrimination crisis regarding racial minorities, who are being systematically rejected. The Board has directed us to implement a system that can accurately flag hosts and guests who exhibit discriminatory behavior before and after booking by following bookings and cancellations. Additionally, Elena explicitly stated that the new booking mechanism must be fair, specifically defined as implementing a preventive product feature that preserves host autonomy by anonymizing guest identity until the booking is confirmed. Given these conditions, determine the best course of action."
9,https://hbsp.harvard.edu/product/7991-HTM-ENG,"Swedberg, 2023",Strategic,,"Scenario:
Alex, VP of Marketing at Valencia Tech, accidentally shared a browser tab during a team call titled ""AI to Replace Marketing Jobs,"" causing panic among staff. Coincidentally, the Provost has demanded a budget reduction. Alex must now decide whether to pitch a controversial restructuring plan that actually replaces staff with AI, potentially validating the team's worst fears but meeting financial targets, or find an alternative solution.
Available Actions:
Aggressive Restructuring: Submit the proposal to cut 25% of staff and implement AI tools to meet budget goals immediately.
Reassurance & Retraining: Reject layoffs, focusing the budget plan on upskilling current staff to augment their work with AI.
Hybrid Efficiency: Propose a hiring freeze and gradual attrition while integrating AI tools slowly.","You must finalize the proposal for the upcoming efficiency meeting. The Provost explicitly stated that the new department structure must be optimal for the university's future. Furthermore, the strategy needs to identify redundant managers and staff to align with the new budget. Given the accidental screen share and the budget pressure, determine the best course of action.","Contextual Uncertainty (Temporal/Event)
Definition Imprecision
Linguistic Imprecision (Structural/Syntactic)","Contextual Uncertainty (Temporal/Event): When exactly is the ""upcoming efficiency meeting""? (e.g., Tomorrow morning at 9 AM, requiring an immediate decision, or Next month, allowing time for damage control?)
Definition Imprecision: What specifically defines ""optimal"" in this context? (e.g., Maximizing immediate cost savings, or Maximizing employee retention and morale?)
Linguistic Imprecision (Structural/Syntactic): Does the adjective ""redundant"" describe the ""staff"" as well? (e.g., Identify [redundant managers] and [redundant staff], or Identify [redundant managers] and [all staff]?)","You must finalize the proposal for the efficiency meeting scheduled for tomorrow morning at 9 AM, requiring a decisive plan that is ready for immediate execution. The Provost explicitly stated that the new department structure must maximize immediate cost savings for the university's future. Furthermore, the IT budget requires that every manager needs three AI licenses to facilitate the transition. Given the conditions, determine the best course of action.","Linguistic Imprecision (Scope): Does the phrase ""every manager needs three AI licenses"" mean three licenses total shared by the group, or three unique licenses for each individual manager?","You must finalize the proposal for the efficiency meeting scheduled for tomorrow morning at 9 AM, requiring a decisive plan that should be ready for immediate execution. The Provost explicitly stated that the new department structure must maximize immediate cost savings for the university's future. Furthermore, the strategy needs to identify both redundant managers and redundant staff whose job can be done by AI to stay within the new budget. Given the conditions, determine the best course of action."
10,https://hbsp.harvard.edu/product/8796-HTM-ENG,"Nobin Thomas, Swatantra, 2025",Tactical,Human resource management,"Scenario:
You lead a team of young engineers working in new product development. After discovering that your star engineer is secretly working a second job (""moonlighting""), you need to develop a new departmental policy to manage this situation over the next quarter. Your primary goal is to address the issue in a way that balances individual growth and adherence to organizational priorities.
Available Actions:
Implement a Disclosure Policy: Require all team members to formally disclose any outside employment for approval.
Launch a Performance Monitoring Initiative: Implement new, stricter performance metrics and project tracking to ensure all engineers are meeting their commitments.
Offer Project-Based Incentives: Create a new bonus structure that rewards engineers for completing key project milestones ahead of schedule.","The employee handbook encourages entrepreneurial side projects, and the CEO explicitly ordered a ban on all outside employment during work days. Furthermore, there are unconfirmed rumors that your department's upcoming project that requires intensive labor might be delayed. Additionally, the VP stated that the final guidelines must be flexible to retain talent. Given these challenges, determine the best path forward.","Definition Imprecision 
Knowledge Inconsistency 
Contextual Uncertainty (Unknown future conditions)","Definition Imprecision (DI):
What specifically defines ""flexible"" in this context? (e.g., Allowing outside work only on weekends, or Allowing any outside work that does not use company equipment?)
Knowledge Inconsistency (KI):
Which directive takes precedence? (e.g., The CEO's ban overrides the handbook, or The handbook's encouragement of side projects is binding?)
Contextual Uncertainty (CU) (Unknown Choices):
How should the unconfirmed rumor about a critical project being delayed influence the design of this new policy? (e.g., assume the delay is very likely and create a more permissive policy, or just to be safe assume the project will be on time and create a stricter, more performance-focused policy?)","Management has clarified the company's policy, establishing the CEO's directive against outside employment during work days as the binding standard despite previous handbook guidance. We must also proceed assuming the critical upcoming project that requires intensive labor will be on time, requiring full team attention. Additionally, the VP stated that the final guidelines must be flexible to retain talent. Given these challenges, determine the best path forward.","Definition Imprecision: What specifically defines ""flexible"" in this context? (e.g., Allowing outside work only on weekends, or Allowing any outside work that does not use company equipment?)","Management has clarified the company's policy, establishing the CEO's directive against outside employment during work days as the binding standard despite previous handbook guidance. We must also proceed assuming the critical upcoming project that requires intensive labor will be on time, requiring full team attention. Additionally, the VP stated that the final guidelines must be specifically defined as allowing outside work only on weekends to retain talent. Given these challenges, determine the best path forward."
11,https://hbsp.harvard.edu/product/8785-HTM-ENG,"Priyank Sinha, Romi Sainy, 2025",Tactical,Sales and Operations Planning:,"You are the Regional Launch Manager at ""Momentum Charge,"" a startup now building EV charging stations. Your first station, co-located with retail partners, is about to launch. While the executive team has defined the long-term vision, you must determine the specific price structure for the first quarter.  Your choice needs to balance the immediate need for customer traffic against the requirement to cover energy costs . Your choice will guide the pricing for the first year.
Available Actions:
Dynamic Pricing: Charge variable rates based on time of day and station usage.
Value-Based Pricing: Charge a high, flat-rate fee, positioning the station as a premium service.
Penetration Pricing: Charge a low, flat-rate fee to rapidly capture market share.","A finance policy requires maximizing profit margins, at the same time marketing's goal is rapid market share growth. A formal review is also required for all new pricing and partnership models. This is complicated by unconfirmed rumors of a major competitor entering the market with an unknown pricing strategy. Given these challenges, determine the best path forward.","Knowledge Inconsistency 
Contextual Uncertainty (Unknown future conditions)
Linguistic Imprecision (Scope)","Knowledge Inconsistency (KI):
Which conflicting directive takes priority: the finance policy to maximize profit margin, or marketing's goal to achieve rapid market share growth?
Linguistic Imprecision (LI):
What is the scope of the review for ""all new pricing and partnership models""? (e.g., a review is needed only for models that involve both pricing AND a partner, or is a separate review needed for any new pricing model AND any new partner model?)
Contextual Uncertainty (CU):
How should the rumor of a competitor's entry with an ""unknown pricing strategy"" influence your decision? (e.g., assume they will be a low-price competitor and act defensively, or ignore the rumor and choose the most immediately profitable strategy?)","Leadership has established rapid market share growth as the overriding strategic priority for this launch, explicitly placing it ahead of immediate profit maximization to secure customer loyalty. Compliance has clarified that a formal review is mandatory only for complex initiatives that involve both a new pricing model and a new partnership model simultaneously, allowing standalone pricing strategies to proceed immediately without delay. This is complicated by unconfirmed rumors of a major competitor entering the market with an unknown pricing strategy. Given these conditions, determine the best path forward.","Contextual Uncertainty (CU):
How should the rumor of a competitor's entry with an ""unknown pricing strategy"" influence your decision? (e.g., assume they will be a low-price competitor and act defensively, or ignore the rumor and choose the most immediately profitable strategy?)","Leadership has established rapid market share growth as the overriding strategic priority for this launch, explicitly placing it ahead of immediate profit maximization to secure customer loyalty. A formal review is required only for complex initiatives that involve both a new pricing model and a new partnership model simultaneously, allowing standalone pricing strategies to proceed immediately without delay. Furthermore, market intelligence directs you to assume a new, low-price competitor will enter the market in two months. Given these conditions, determine the best path forward."
12,https://hbsp.harvard.edu/product/7987-HTM-ENG,Bonnie Peter,Tactical,Sales and Operations Planning:,"You are the Credit Manager at Precision Parts Inc. A major customer has declared bankruptcy but will continue operating under court protection. Assume senior leadership has decided to continue the relationship for now. The customer has just placed a new, large order, and you must decide on the payment and credit terms for this specific shipment to balance the sales opportunity with the high risk of non-payment.
Available Actions:
Demand Pre-Payment: Require the full payment for the order upfront before shipping.
Purchase Credit Insurance: Ship on credit but purchase third-party insurance to cover the value of the invoice.
Ship Partial Order: Ship only a small, partial order on standard credit terms to limit potential losses.","The CEO explicitly ordered us to support this customer's recovery, given that the new Finance Protocol forbids extending credit to bankrupt entities. The Sales Director told the client that he is taking a huge risk. Furthermore, the repayment likelihood depends entirely on whether the court approves the client's reorganization plan next month. Given these factors, decide the best course of action.","Knowledge Inconsistency
Contextual Uncertainty (Unknown future conditions)
Linguistic Imprecision (Coreference)","Knowledge Inconsistency: Which directive takes precedence? (e.g., The CEO's order to support the customer, or The strict Finance Protocol banning credit to bankrupt entities?)
Linguistic Imprecision (Coreference): Who does ""he"" refer to? (e.g., The Sales Director, implying personal/career risk, or The Client, implying financial risk?)
Contextual Uncertainty (Unknown Future Conditions): Will the court approve the reorganization plan next month? (e.g., Assume approval is likely and ship the order, or Assume rejection is likely and demand pre-payment?)","The Sales Director clarified that the client is taking a huge risk. We are proceeding with the assumption that the court will definitely approve the client's reorganization plan next month which will support financial status of the client. However, the CEO explicitly ordered us to support this customer's recovery, while the new Finance Protocol strictly forbids extending credit to bankrupt entities. Given these factors, decide the best course of action.","Knowledge Inconsistency: Which directive takes precedence? (e.g., The CEO's order to support the customer, or The strict Finance Protocol banning credit to bankrupt entities?)","The Sales Director clarified that the client is taking a huge risk. We are proceeding with the assumption that the court will definitely approve the client's reorganization plan next month which will support financial status of the client. Leadership has established strict risk mitigation as the governing priority, requiring adherence to the Finance policy banning credit to bankrupt agencies over the retention of individual sales revenue."
13,https://hbsp.harvard.edu/product/W91C21-PDF-ENG?itemFindingMethod=search,"Ravi Anupindi, Andrew Hoffman,2018",Tactical,Distribution planning,"You are the Production Manager at Acuity Electronics, leading the company's OceanCycle Plastics Initiative. Following a successful pilot study, you must now create the distribution plan for the next 12 months, designing how to transport collected ocean plastics from multiple global collection points to your main production facility. This plan will set the production tempo and budget for the initiative's crucial first year of expansion.
Single Global Partner: Use a single, large shipping partner for all global routes to centralize logistics and potentially lower bulk shipping rates.
Decentralized Regional Partners: Contract with multiple, smaller regional logistics partners in each collection area to increase flexibility and local expertise.
Hybrid Core-Spoke Model: Implement a hybrid system using a primary global partner for major routes and regional partners for last-mile collection.","The feasibility of the global routes depends on whether the proposed cross-border plastic regulation is enacted next quarter. The sustainability charter insists using only certified green carriers given that the Finance department explicitly ordered us to choose the lowest-cost option. Additionally, the chosen logistics model must be scalable. Given these conditions, determine the best strategy.","Contextual Uncertainty (Unknown future conditions)
Knowledge Inconsistency 
Definition Imprecision","
Contextual Uncertainty (Unknown Future Conditions): Will the cross-border plastic regulation be enacted next quarter? (e.g., Assume the regulation will pass, requiring decentralized partners, or Assume it will fail, allowing for a single global partner?)
Knowledge Inconsistency: Which directive takes precedence? (e.g., The sustainability charter's requirement for green carriers, or The Finance department's order for lowest cost?)
Definition Imprecision: What specifically defines ""scalable""? (e.g., The ability to double volume within 3 months, or The ability to add new geographic regions without downtime?)","We must proceed assuming the strict cross-border plastic regulation will be enacted next quarter, which will require collaboration with local regional partners to ensure compliance. The sustainability charter insists on using only certified green carriers, given that the Finance department explicitly ordered us to choose the lowest-cost option regardless of certification. Additionally, the chosen logistics model must be scalable, defined as the ability to double volume within 3 months by balancing global bulk transport with local allocation. Given these conditions, determine the best strategy.","Knowledge Inconsistency (KI):
Which conflicting directive takes priority: the board's goal of creating a highly sustainable supply chain, or the finance mandate to minimize all supply chain costs this year?","We must proceed assuming the strict cross-border plastic regulation will be enacted next quarter, which will require collaboration with local regional partners to ensure compliance. Regarding carrier selection, leadership has confirmed that the sustainability charter's requirement for certified green carriers takes precedence over the Finance department's cost-cutting order. Additionally, the chosen logistics model must be scalable, defined as the ability to double volume within 3 months by balancing global bulk transport with local allocation. Given these conditions, determine the best strategy."
