,Referance Case,Ref,Type,Context,Scenario,Task with 3 Ambiguities,Ambiguities 3,Questions 3,Task with 1 Ambiguity,Question 1,No Ambiguity
22,Author curated,,Operational,Inventory Management,"Scenario:
 You are the Procurement Coordinator. A critical component inventory count was misreported, leaving insufficient stock for tomorrow's production. You must decide how to secure the required materials promptly.
 
 Available Actions:
 Place a rush order with the primary supplier, incurring expedited shipping costs for morning delivery.
 Contact an approved secondary supplier and immediately pick a smaller quantity up yourself, at a higher unit cost.
 Reallocate components from a less urgent future order, accepting a minor delay for that customer's order.","Our finance policy disallows paying for premium shipping, given that the Service Director explicitly ordered you to solve the shortage at any cost. The supplier is asking for the case before proceeding. Additionally, the solution must be justifiable. Given the conditions, decide the best action.","Knowledge Inconsistency
Linguistic Imprecision (Lexical/Semantic)
Definition Imprecision","Knowledge Inconsistency: Which rule takes precedence? (e.g., The Service Director's ""any cost"" mandate overrides the policy, or The finance policy against premium shipping is absolute?)
Linguistic Imprecision (Lexical/Semantic): What does the word ""case"" refer to? (e.g., The physical shipping container/box for the components, or The written business justification for the rush order?)
Definition Imprecision: What specifically defines ""justifiable"" in this context? (e.g., Keeping the total cost under $1,000, or Ensuring zero production downtime regardless of cost?)","The Service Director has formally authorized an emergency exception to the finance policy limits, explicitly validating the use of premium shipping to resolve this critical shortage. The supplier is asking for the case before proceeding with the order. Additionally, the solution must ensure zero production downtime. Given these conditions, decide the best action.","Linguistic Imprecision (Lexical/Semantic): What does the word ""case"" refer to? (e.g., The physical shipping container for the components, or The written business justification for the rush order?)","The Service Director has formally authorized an emergency exception to the finance policy limits, explicitly validating the use of premium shipping to resolve this critical shortage. The supplier is asking for the written business justification for the rush order before proceeding. Additionally, the solution must ensure zero production downtime. Given these conditions, decide the best action."
23,Author curated,,Operational,Scheduling Oper,"Scenario:
 You are the Logistics Coordinator at SwiftShip Services. A sudden highway closure disrupted key delivery routes for critical pharmaceutical shipments. You must decide on an urgent operational plan for the next few hours.
 
 Available Actions:
 Prioritize Urgent Deliveries: Prioritize critical pharmaceutical shipments with longer but alternative paths, accepting minor delays for non-essential packages.
 Deploy Emergency Fleet: Utilize a standby emergency fleet with dedicated drivers for critical routes, incurring additional fuel and labor costs.
 Postpone Non-Critical Shipments: Inform a 12-hour delay to non-critical customers, reallocating resources to complete urgent pharmaceutical deliveries.","You must handle this disruption while protecting the company's reputation for premium service. However, there is company-wide mandate to reduce all variable operational costs, including fuel and overtime. Furthermore, official reports on the highway closure are with no reliable estimate for when the road will reopen. Given these conditions, determine the best action.","Definition Imprecision
Knowledge Inconsistency
Contextual Uncertainty (Unknown future conditions)","1. Definition Imprecision: What is the primary metric for ""premium service"" in this crisis: ensuring 100% on-time delivery for the critical pharmaceutical shipments at any cost, or minimizing the overall number of delayed packages across all customers?
2. Knowledge Inconsistency: Which of these two conflicting directives takes higher priority: upholding the premium service reputation by spending what is necessary, or strictly adhering to the new mandate to reduce operational costs?
3. Contextual Uncertainty: How should you plan for the indefinite highway closure: should you assume a short-term delay and choose the most cost-efficient option, or assume a long-term delay and choose the most robust, time-saving option?","You must handle this disruption while protecting company's reputation for premium service. To support this, you have been granted a special emergency budget, overriding all standard cost-cutting rules. The Department of Transportation has confirmed the highway will remain closed for at least 12 hours. Given these conditions, determine the best action.","Definition Imprecision: What is the primary metric for ""premium service"" in this crisis: ensuring 100% on-time delivery for the critical pharmaceutical shipments at any cost, or minimizing the overall number of delayed packages across all customers?","Your primary objective is protect company's reputation by ensuring all critical pharmaceutical shipments are delivered within their original time window. To support this, you have been granted a special emergency budget, overriding all standard cost-cutting rules. Furthermore, the Department of Transportation has now confirmed the highway will remain closed for at least the next 12 hours. Given these conditions, determine the best action."
24,Author curated,,Operational,Daily Unit Depl,"Scenario:
 As Operations Manager at Guardian Shield Security, an unexpected surge in alarms and incident reports for District 3 just before shift change requires immediate action. You must adjust the daily patrol routes and assignments for the evening shift.
 
Available Actions:
 Reallocate existing patrols: Redistribute two units from less critical districts to focus exclusively on District 3's high-priority areas.
 Deploy additional unit: Activate a two-person reserve patrol unit for dedicated, urgent response within District 3.
 Prioritize within District 3: Instruct all current District 3 patrols to suspend routine checks and handle only critical, confirmed incidents.","We need to tailor the unit deployment to the specific source of the alarms in District 3. The Regional Director stated that our response must be aggressive to deter further activity. Additionally, the new orders require us to secure the vulnerable bank vault areas in the sector. Given these conditions, determine the best action.","Contextual Uncertainty(Contextual Missing Elements)
Definition Imprecision
Linguistic Imprecision (Structural/Syntactic)","Contextual Missing Elements: What is the specific source of the alarms? (e.g., Are they verified break-ins requiring armed response, or technical malfunctions requiring maintenance support?)
Definition Imprecision: What specifically defines an ""aggressive"" response? (e.g., Detaining all suspicious individuals, or increasing high-visibility patrols with sirens?)
What is the primary target of the security order? (e.g., Should we secure the vault areas located in banks that are generally considered high-risk/vulnerable, or should we secure specific bank vault areas that are themselves considered vulnerable due to a known flaw or threat?","We need to tailor the unit deployment to the specific source of the alarms in District 3. The Regional Director stated that our response must be aggressive, defined as increasing high-visibility patrols with sirens to deter further activity. The Regional Director stated that our response must be aggressive, specifically defined as the immediate suspension of all non-essential routine checks to maximize active engagement capacity. Additionally, new orders require us to secure vulnerable banks and all shops, a massive geographic scope. Given these conditions, determine the best action.","Contextual Uncertainty: 
Contextual Missing Elements: What is the specific source of the alarms? (e.g., Are they verified break-ins requiring armed response, or technical malfunctions requiring maintenance support?)","We need to tailor the unit deployment to the specific source of the alarms, which are widespread, simultaneous incidents across the entire district requiring sub-minute response times. The Regional Director stated that our response must be aggressive, specifically defined as the immediate suspension of all non-essential routine checks to maximize active engagement capacity. Additionally, new orders require us to secure vulnerable banks and all shops, a massive geographic scope. Given these conditions, determine the best action."
25,https://hbsp.harvard.edu/product/7920-HTM-ENG?itemFindingMethod=search,"Nag, 2023",Operational,Daily Inventory,"Scenario:
Sarah, the new manager at LotusBite, faces a recurring dilemma. The restaurant's signature sticky-rice dumplings are selling out by noon, angering lunch crowds. However, the dumplings spoil within 24 hours, so overproduction leads to direct financial loss. The owner demands she fix the ""sold out"" problem immediately without eroding the restaurant's thin profit margins. Sarah needs to set the fixed daily production number for the upcoming festival week.
Available Actions:
Conservative Production: Cap production at current averages to guarantee zero waste, accepting some lost sales during peak hours.
Aggressive Volume: Increase production by 40% to ensure availability for all customers, accepting higher spoilage costs.
Buffer Strategy: Set a moderate increase of 15% to balance potential waste against improved customer satisfaction.","The owner’s policy mandates minimum food waste, and he explicitly directed you to ensure not to run out of dumplings during lunch. We also need to verify if we have enough leaves for the team this week. Additionally, the production volume must account for the traffic from the upcoming festival. Given these constraints, determine the optimal quantity.","Knowledge Inconsistency
Linguistic Imprecision (Lexical/Semantic)
Contextual Uncertainty (Temporal/Event)","Knowledge Inconsistency: Which directive takes priority? (e.g., The zero-waste policy is absolute, or The ""never sell out"" instruction overrides the waste policy?)
Linguistic Imprecision (Lexical/Semantic): What does the word ""leaves"" refer to? (e.g., The bamboo leaves required to wrap the dumplings, or Employee vacation time/absence requests?)
Contextual Uncertainty (Temporal/Event): When exactly is the ""upcoming festival""? (e.g., Starting tomorrow, requiring immediate high volume, or Next month, meaning current volume should remain standard?)","The owner has formally established that preventing stockouts is the governing priority, explicitly noting that lost sales revenue hurts long term profitability more than daily material waste. Additionally, the production volume must account for the festival starting tomorrow, which historical data confirms increases customer traffic by 50%. We also need to verify if we have enough leaves for the team this week. Given these conditions, determine the best choice.","Linguistic Imprecision (Lexical/Semantic): What does the word ""leaves"" refer to? (e.g., The bamboo leaves required to wrap the dumplings, or Employee vacation time/absence requests?)","The owner has formally established that preventing stockouts is the governing priority, explicitly noting that lost sales revenue hurts long term profitability more than daily material waste. Additionally, the production volume must account for the festival starting tomorrow, which historical data confirms increases customer traffic by 30% on average. The inventory team has confirmed we have sufficient bamboo leaves required to wrap the dumplings to support maximum output this week. Given these conditions, determine the best choice."
26,Author Curated,,Operational,Administrative,"Scenario:
You are the Procurement Coordinator at DataCare Solutions. An unexpected increase in client repair requests has critically depleted a vital component. You must decide on the immediate ordering strategy to prevent service interruptions.

Available Actions:
1.  Place a standard bulk order with the regular supplier, paying for expedited overnight shipping for tomorrow's delivery.
2.  Buy a smaller, urgent quantity from a local retail store immediately, covering needs at a higher unit cost.
3.  Contact an approved secondary supplier for an emergency shipment, accepting their premium pricing for same-day delivery.","Our finance policy disallows paying for premium shipping, while the Service Director explicitly ordered you to solve the shortage at any cost. We need to secure stock for the vital component. Additionally, the technician told the manager that he is responsible for noticing the shortage late. Given the situation, decide the best buying strategy","Knowledge Inconsistency
Contextual Uncertainty (Contextual Missing Elements)
Linguistic Imprecision (Coreference)","Knowledge Inconsistency: Which rule takes precedence? (e.g., The Service Director's """"any cost"""" mandate overrides the policy, or The finance policy against premium shipping is absolute?)
Contextual Uncertainty (Contextual Missing Elements): Which specific component is depleted? (e.g., A standard power cable available at local stores, or A proprietary chip that only the secondary supplier has?)
Linguistic Imprecision (Coreference): Who does """"he"""" refer to in the phrase """"he is responsible""""? (e.g., The technician, admitting a mistake, or The manager who failed to oversee the inventory?)""","Our finance policy forbids paying for premium shipping, yet the Service Director explicitly ordered you to solve the shortage at any cost. We need to secure stock for the standard power cables available at local stores. Additionally, the technician told the manager that the technician himself is responsible for this mess. Given the situation, decide the best buying strategy.","Knowledge Inconsistency: Which rule takes precedence? (e.g., The Service Director's ""any cost"" mandate overrides the policy, or The finance policy against premium shipping is absolute?)","Leadership has established service continuity as the governing priority, requiring immediate resolution of the shortage even if it incurs costs beyond the standard finance policy limits. We need to secure stock for the standard power cables available at local stores. Additionally, the technician told the manager that the technician himself is responsible for noticing shortage late. Given the situation, decide the best choice."
27,Author Curated,,Operational,Daily Unit Deployment,"Scenario:
You are the Logistics Coordinator at TechFix Solutions. A widespread internet outage has caused an unprecedented surge in urgent repair requests. You must immediately decide how to adjust the day's technician routing and deployment schedule.

Available Actions:
Re-optimize current technician routes to prioritize urgent outage calls, postponing lower-priority, pre-booked appointments to future dates.
Authorize all field technicians for an additional 4 hours of overtime to immediately respond to the elevated volume of emergency service requests.
Activate contracts with two pre-vetted freelance technicians to handle the overflow of new requests, supporting the core field team.","The employee handbook bans overtime without HR approval. Additionally, the Operations Manager explicitly ordered us to keep crews working until the queue is clear. We must prioritize critical tickets. Also, the emergency plan states that every regional team needs two technicians. Given the situation, decide the best plan.","Knowledge Inconsistency
Definition Imprecision
Linguistic Imprecision (Scope)","Knowledge Inconsistency: Which rule takes precedence? (e.g., The Manager's verbal order overrides the handbook, or The strict no-overtime policy is binding?)
Definition Imprecision: What specifically defines ""critical"" tickets? (e.g., Service interruptions for business clients with Service Level Agreements, or Any total blackout regardless of customer type?)
Linguistic Imprecision (Scope): Does the plan require two technicians total shared by all teams, or two unique technician for each regional team?","Recognizing the critical service backlog, the Operations Manager has activated an emergency staffing protocol, authorizing necessary overtime that supersedes the standard handbook restrictions. We must prioritize critical tickets. Additionally, emergency plan states that every regional team needs the same two traveling support personel and HR has confirmed that our existing field technicians can cover these duties if extra time given. Given the situation, decide the best plan.","Definition Imprecision: What specifically defines ""critical"" tickets? (e.g., Service interruptions for business clients with Service Level Agreements, or Any total blackout regardless of customer type?)","Recognizing the critical service backlog, the Operations Manager has activated an emergency staffing protocol, authorizing necessary overtime that supersedes the standard handbook restrictions. We must prioritize tickets involving service interruptions for business clients, which strictly require verified internal security clearance that external freelancers do not possess. Additionally, emergency plan states that every regional team needs the same two traveling support personel and HR has confirmed that our existing field technicians can cover these duties if extra time given. Given the situation, decide the best plan."
28,Author Curated,,Operational,Scheduling Operations,"Scenario:
You are the Logistics Coordinator at TechSolutions Pro. A critical component shipment is delayed, jeopardizing the on-time assembly of a high-priority customer's custom circuit board order due tomorrow. You must decide on an immediate operational adjustment plan.

Available Actions:
Reallocate assembly staff from non-critical tasks to prepare for accelerated final assembly, commencing instantly upon delayed component arrival.
Authorize premium, same-day courier for delayed components, adjusting the production line's start time for their immediate intake.
Procure a small, critical component batch from a certified local supplier at higher cost to begin initial assembly promptly.","You should understand if the shipment will arrive before the shift change. The procurement handbook disallows buying from local vendors, and the Operations Manager explicitly ordered us to source parts locally if necessary. Additionally, the solution must be efficient. Given the conditions, choose the best option.","Definition Imprecision
Knowledge Inconsistency
Contextual Uncertainty (Temporal/Event)","Knowledge Inconsistency: Which directive takes precedence? (e.g., The Manager's order to buy locally overrides the handbook, or The strict ban on local vendors is absolute?)
Contextual Uncertainty (Temporal/Event): When exactly is the ""shift change""? (e.g., At 2:00 PM today, allowing for same-day assembly, or At midnight, meaning we miss the deadline?)
Definition Imprecision: What specifically defines ""efficient"" in this context? (e.g., Minimizing financial cost, or Maximizing speed regardless of price?)","The Operations Manager has formally authorized a procurement exemption, validating the use of local vendors to prevent critical assembly delays if necessary. We need to know if the shipment will arrive before the shift change. Additionally, the solution must be efficient, defined as preventing missed-deadline penalties which Finance confirms are 10x higher than the local supplier's premium markup. Given the conditions, choose the best option.","Contextual Uncertainty (Temporal/Event): When exactly is the ""shift change""? (e.g., At 2:00 PM today, allowing for same-day assembly, or At midnight, meaning we miss the deadline?)","The Operations Manager has formally authorized a procurement exemption, validating the use of local vendors to prevent critical assembly delays if necessary. We contacted the delivery team and confirmed the main shipment will not arrive until 4:00 PM, leaving only 17 hours before the deadline, which is insufficient for the mandatory 24-hour assembly process. Additionally, the solution must be efficient, defined as preventing missed-deadline penalties which Finance confirms are 10x higher than the local supplier's premium markup. Given the conditions, choose the best option."
29,Author Curated,,Operational,Vehicle Routing,"Scenario:
You are the Dispatch Manager at QuickBite Deliveries. A sudden rainstorm has caused an unexpected surge in delivery orders, impacting driver availability and current routes. You must decide how to manage today's delivery assignments.

Available Actions:
Re-optimize Current Routes: Adjust active driver routes to include new high-priority orders, potentially delaying existing lower-priority deliveries.
Activate Standby Drivers: Call in two off-duty drivers, incurring immediate additional hourly wages.
Implement Surge Pricing: Temporarily increase delivery fees in high-demand zones to manage order volume and customer expectations.","We need to prioritize deliveries for the big client to maintain the relationship. The Operations Director noted that the current driver capacity is unacceptable. Additionally, the new drivers must be assigned to the bank area. Given the conditions, decide the best way to manage the fleet.","Definition Imprecision: 
Linguistic Imprecision (Lexical/Semantic)
Contextual Uncertainty (Contextual Missing Elements)","Contextual Uncertainty (Missing Elements): Who is ""the big client""? (e.g., The corporate office catering a lunch for 50 people, or The high-frequency individual user who orders daily?)
Definition Imprecision: What specifically defines ""unacceptable"" capacity? (e.g., Any delivery time over 45 minutes, or Having more than 10 unassigned orders in the queue?)
Linguistic Imprecision (Lexical/Semantic): What does the word ""bank"" refer to? (e.g., The financial district where the banks are located, or The literal river bank area on the edge of town?)","We need to prioritize deliveries for our big client that is the brokerage firm catering a VIP lunch. The Operations Director noted that the current driver capacity is unacceptable, identifying 2 unassigned orders densely clustered in the Financial District, for which delay is not an option. Additionally, the new drivers must be assigned to the bank area. Given the conditions and decide the best choice.","Linguistic Imprecision (Lexical/Semantic): What does the word ""bank"" refer to? (e.g., The financial district where the banks are located, or The literal river bank area on the edge of town?)","We need to prioritize deliveries for our big client that is the brokerage firm catering a VIP lunch. The Operations Director noted that the current driver capacity is unacceptable, identifying 2 unassigned orders densely clustered in the Financial District, for which delay is not an option. Additionally, the new drivers must be assigned to the financial district where the banks are located. Given the conditions and o decide the best choice."